{"id":"RES-GEI-GEN1-001","type":"result","title":"Initial evaluation remains provisional","status":"active","version":"1.0.9","result_status":"preliminary","result":"The current dataset establishes a structured basis for comparison and traceability, but does not by itself establish that Genesis 1 was authored as a hydraulic-engineering blueprint.","investigation_ids":["INV-GEI-GEN1-001"],"evidence_ids":["EVD-GEI-001"],"counterevidence_ids":[],"confidence":"C1","notes":"A stronger result requires passage-level, linguistic, technological, chronological, and counterevidence testing."}